{
  "schemaVersion": 1,
  "id": "whisper-base",
  "version": "1.0.0",
  "name": "Whisper Base (multilingual)",
  "description": "Multilingual Whisper base weights in ggml form, repackaged by Talex-Touch for the on-device Tuff speech runtime. Strong on Mandarin and English; emits Traditional Chinese for zh audio, so the runtime must apply Simplified conversion.",
  "engine": "whisper-cpp",
  "engineMinVersion": "1.7.0",
  "languages": ["zh", "en", "ja", "ko"],
  "defaultLanguage": "zh",
  "runtime": {
    "kind": "ggml",
    "file": "ggml-base.bin",
    "bytes": 147951465,
    "sha256": "60ed5bc3dd14eea856493d334349b405782ddcaf0028d4b5df4088345fba2efe"
  },
  "quantization": "none",
  "capabilities": {
    "stream": true,
    "upload": true,
    "timestamps": true,
    "punctuation": true,
    "itn": false
  },
  "text": {
    "script": "traditional",
    "requiresSimplifiedConversion": true,
    "punctuationPolicy": "model"
  },
  "source": {
    "provider": "huggingface",
    "repo": "ggerganov/whisper.cpp",
    "url": "https://huggingface.co/ggerganov/whisper.cpp/resolve/main/ggml-base.bin",
    "upstreamVersion": "whisper-base",
    "derivedFrom": "openai/whisper-base"
  },
  "license": {
    "spdx": "MIT",
    "redistributable": true
  },
  "benchmark": {
    "host": "Apple M4 Pro (arm64, Metal)",
    "dataset": "macOS `say -v Tingting` synthetic Mandarin, 3.44 s",
    "sampleCount": 1,
    "rtf": 0.33,
    "notes": "Measured 1.14 s wall for 3.44 s audio, cold model load included. Content transcribed correctly; script was Traditional."
  }
}
